{
  "id": "782b1200-e29b-41d4-a716-446655448888",
  "record_type": "preference",
  "content": "User prefers answers in bullet points and avoids verbose introductions.",
  "source_conversations": [
    "550e8400-e29b-41d4-a716-446655440000"
  ],
  "created_at": "2026-03-15T09:50:00Z",
  "updated_at": "2026-03-15T09:50:00Z",
  "confidence": 0.95,
  "platform": "claude",
  "tags": ["formatting", "communication"],
  "active": true
}
